{
  "schema_version": "1.0",
  "analysis_id": "an_2026-10-07_gettysburg_demo_01",
  "created_at": "2026-10-07T10:30:00Z",
  "metadata": {
    "pipeline_version": "0.0.0-fixture",
    "taxonomy_version": "1.0.0",
    "language": "en",
    "sample_rate_hz": 16000,
    "alignment_method": "fixture (hand-authored; not produced by a real aligner)",
    "comparison_mode": "reference_word_aligned",
    "explanation_method": "template",
    "seed": 7
  },
  "reference": {
    "id": "gettysburg_good",
    "label": "Reference (good delivery)",
    "audio_file": "data/sources/gettysburg/good.wav",
    "transcript_file": "data/sources/gettysburg/transcript.txt",
    "duration_s": 27.868,
    "speaker_id": "spk_ref"
  },
  "participant": {
    "id": "gettysburg_mixed_demo",
    "label": "Participant recording",
    "audio_file": "data/flawed/gettysburg/mixed_demo.wav",
    "transcript_file": "data/sources/gettysburg/transcript.txt",
    "duration_s": 28.718,
    "speaker_id": "spk_ref"
  },
  "analyzed_duration_s": 28.718,
  "overall_score": {
    "value": 78.4,
    "max": 100,
    "rubric_version": "rubric_v1",
    "summary": "6 delivery flaw regions found; pausing and pacing cost the most points."
  },
  "rubric_scores": [
    {
      "component_id": "pacing",
      "display_name": "Pacing",
      "score": 81.0,
      "max": 100,
      "weight": 0.3,
      "penalty_total": 19.0,
      "flaw_region_ids": ["fr_01", "fr_06"],
      "comment": "2 flaw region(s) deducted 19 points."
    },
    {
      "component_id": "pausing",
      "display_name": "Pausing",
      "score": 64.0,
      "max": 100,
      "weight": 0.25,
      "penalty_total": 36.0,
      "flaw_region_ids": ["fr_03", "fr_04"],
      "comment": "2 flaw region(s) deducted 36 points."
    },
    {
      "component_id": "expressiveness",
      "display_name": "Vocal expressiveness",
      "score": 82.0,
      "max": 100,
      "weight": 0.25,
      "penalty_total": 18.0,
      "flaw_region_ids": ["fr_02"],
      "comment": "1 flaw region(s) deducted 18 points."
    },
    {
      "component_id": "volume",
      "display_name": "Volume & projection",
      "score": 88.0,
      "max": 100,
      "weight": 0.2,
      "penalty_total": 12.0,
      "flaw_region_ids": ["fr_05"],
      "comment": "1 flaw region(s) deducted 12 points."
    }
  ],
  "flaw_regions": [
    {
      "id": "fr_01",
      "flaw_type": "pace_fast",
      "severity_level": 3,
      "severity_label": "moderate",
      "start_s": 1.128,
      "end_s": 3.684,
      "duration_s": 2.556,
      "reference_start_s": 1.128,
      "reference_end_s": 4.578,
      "confidence": 0.91,
      "detection": {
        "method": "word_window_deviation",
        "metric": "abs_delta_pct",
        "metric_value": 34.98,
        "threshold": 6
      },
      "transcript": {
        "text": "and seven years ago our fathers brought forth on",
        "word_start_index": 2,
        "word_end_index": 10
      },
      "evidence": [
        {
          "feature": "speech_rate_wps",
          "unit": "words/s",
          "reference_value": 2.609,
          "participant_value": 3.521,
          "delta": 0.912,
          "delta_pct": 35.0,
          "normalization": "Compared to the reference over the SAME transcript word range.",
          "role": "primary"
        }
      ],
      "explanation": {
        "summary": "Speech rate rose to 3.5 words/s against a reference of 2.6 words/s (+35%) over \"and seven years ago our fathers brought forth on\" (1.1-3.7 s).",
        "cause": "The words in this span were spoken noticeably faster than the reference delivery of the same text.",
        "impact": "Listeners get less time to process each word, and emphasis and pauses get squeezed out.",
        "suggestion": "Slow down on this passage and let key phrases breathe.",
        "method": "template",
        "evidence_features": ["speech_rate_wps"]
      }
    },
    {
      "id": "fr_02",
      "flaw_type": "monotone",
      "severity_level": 4,
      "severity_label": "strong",
      "start_s": 6.14,
      "end_s": 11.712,
      "duration_s": 5.572,
      "reference_start_s": 7.034,
      "reference_end_s": 12.606,
      "confidence": 0.88,
      "detection": {
        "method": "word_window_deviation",
        "metric": "abs_delta_pct",
        "metric_value": 79.89,
        "threshold": 10
      },
      "transcript": {
        "text": "conceived in Liberty, and dedicated to the proposition that all men are created",
        "word_start_index": 16,
        "word_end_index": 28
      },
      "evidence": [
        {
          "feature": "f0_std_st",
          "unit": "semitones",
          "reference_value": 2.392,
          "participant_value": 0.481,
          "delta": -1.911,
          "delta_pct": -79.9,
          "normalization": "Semitones relative to the speaker median; comparable across speakers.",
          "role": "primary"
        }
      ],
      "explanation": {
        "summary": "Pitch variation fell to 0.5 semitones from 2.4 semitones in the reference (-80%) over \"conceived in Liberty, and dedicated to the proposition that all men are created\" (6.1-11.7 s).",
        "cause": "The pitch contour in this span is much flatter than in the reference, so stress and intonation cues are missing.",
        "impact": "The passage sounds flat and unengaged; key words are not emphasised.",
        "suggestion": "Add rise and fall on important words and at phrase boundaries.",
        "method": "template",
        "evidence_features": ["f0_std_st"]
      }
    },
    {
      "id": "fr_03",
      "flaw_type": "short_pauses",
      "severity_level": 4,
      "severity_label": "strong",
      "start_s": 12.122,
      "end_s": 12.202,
      "duration_s": 0.08,
      "reference_start_s": 13.016,
      "reference_end_s": 13.566,
      "confidence": 0.79,
      "detection": {
        "method": "word_window_deviation",
        "metric": "abs_delta_pct",
        "metric_value": 85.45,
        "threshold": 10
      },
      "transcript": {
        "text": "equal. Now",
        "word_start_index": 29,
        "word_end_index": 30
      },
      "evidence": [
        {
          "feature": "pause_duration_s",
          "unit": "s",
          "reference_value": 0.55,
          "participant_value": 0.08,
          "delta": -0.47,
          "delta_pct": -85.5,
          "normalization": "Compared to the reference gap at the same word boundary.",
          "role": "primary"
        }
      ],
      "explanation": {
        "summary": "The pause at \"equal. Now\" lasted 0.08 s versus 0.55 s in the reference (85% shorter), at 12.1-12.2 s.",
        "cause": "The speaker moved on almost immediately at a phrase boundary where the reference pauses.",
        "impact": "Ideas run together and the audience has no moment to absorb the point.",
        "suggestion": "Hold the pause at sentence and idea boundaries.",
        "method": "template",
        "evidence_features": ["pause_duration_s"]
      }
    },
    {
      "id": "fr_04",
      "flaw_type": "long_pauses",
      "severity_level": 4,
      "severity_label": "strong",
      "start_s": 15.998,
      "end_s": 17.728,
      "duration_s": 1.73,
      "reference_start_s": 17.362,
      "reference_end_s": 17.392,
      "confidence": 0.96,
      "detection": {
        "method": "word_window_deviation",
        "metric": "abs_delta",
        "metric_value": 1.7,
        "threshold": 0.25
      },
      "transcript": {
        "text": "testing whether",
        "word_start_index": 39,
        "word_end_index": 40
      },
      "evidence": [
        {
          "feature": "pause_duration_s",
          "unit": "s",
          "reference_value": 0.03,
          "participant_value": 1.73,
          "delta": 1.7,
          "delta_pct": 5666.7,
          "normalization": "Compared to the reference gap at the same word boundary.",
          "role": "primary"
        }
      ],
      "explanation": {
        "summary": "A 1.73 s silence at \"testing whether\" is 1.70 s longer than the reference pause (0.03 s), at 16.0-17.7 s.",
        "cause": "The speaker stopped mid-phrase for far longer than the reference delivery does.",
        "impact": "The flow breaks, which can read as losing one's place or hesitation.",
        "suggestion": "Keep the phrase connected; save long pauses for major transitions.",
        "method": "template",
        "evidence_features": ["pause_duration_s"]
      }
    },
    {
      "id": "fr_05",
      "flaw_type": "low_volume",
      "severity_level": 3,
      "severity_label": "moderate",
      "start_s": 20.618,
      "end_s": 23.73,
      "duration_s": 3.112,
      "reference_start_s": 20.282,
      "reference_end_s": 23.394,
      "confidence": 0.93,
      "detection": {
        "method": "word_window_deviation",
        "metric": "abs_delta",
        "metric_value": 9.31,
        "threshold": 2.0
      },
      "transcript": {
        "text": "conceived and so dedicated, can long endure.",
        "word_start_index": 47,
        "word_end_index": 53
      },
      "evidence": [
        {
          "feature": "rms_db_rel",
          "unit": "dB",
          "reference_value": -0.066,
          "participant_value": -9.374,
          "delta": -9.308,
          "delta_pct": -14058.5,
          "normalization": "dB minus median speech-frame dB of the same recording.",
          "role": "primary"
        }
      ],
      "explanation": {
        "summary": "Loudness dropped 9.3 dB relative to the reference (participant -9.4 dB vs -0.1 dB) over \"conceived and so dedicated, can long endure.\" (20.6-23.7 s).",
        "cause": "The energy level in this span is well below the recording's normal speaking level.",
        "impact": "The passage may be hard to hear and sounds unconfident.",
        "suggestion": "Keep projection steady through the end of sentences and phrases.",
        "method": "template",
        "evidence_features": ["rms_db_rel"]
      }
    },
    {